[
  {
    "id": "event.tang.xuanwumen",
    "uuid": "3927be51-7bfa-4761-98e7-5c8d79891e9a",
    "name": "玄武门之变",
    "name_traditional": "玄武門之變",
    "category": ["coup"],
    "time": {"start": 626, "end": 626, "original": "武德九年六月庚申", "precision": "day"},
    "place": ["place.changan"],
    "participants": [
      {"person": "person.tang.lishimin", "role": "instigator"},
      {"person": "person.tang.liyuan", "role": "subject"}
    ],
    "related_events": ["event.sui.liyuan-qibing", "event.tang.zhenguan"],
    "description": "秦王李世民与太子李建成、齐王李元吉矛盾激化。六月四日，世民伏兵玄武门，射杀建成、元吉，尉迟敬德擐甲入宫。高祖李渊遂立世民为太子，八月传位。政变血腥而高效，为贞观之治的开端，也是后世嫡长继承制与军功继承冲突的经典案例。",
    "outcome": "李世民继位，贞观之治开启",
    "sources": [{"title": "旧唐书·太宗本纪", "type": "primary", "ref": "卷二"}, {"title": "资治通鉴·唐纪七", "type": "primary"}],
    "_meta": {"created_by": "ai-pipeline", "model": "kimi-k3", "prompt_version": "suitang-v1", "version": 1}
  },
  {
    "id": "event.tang.zhenguan",
    "uuid": "bf643c22-7087-45eb-be24-3993777a9a34",
    "name": "贞观之治",
    "name_traditional": "貞觀之治",
    "category": ["governance", "golden-age"],
    "time": {"start": 627, "end": 649, "original": "贞观元年至二十三年", "precision": "year"},
    "place": ["place.changan"],
    "participants": [{"person": "person.tang.lishimin", "role": "decision-maker"}],
    "related_events": ["event.tang.xuanwumen", "event.tang.xuanzang"],
    "description": "唐太宗以隋亡为鉴，虚心纳谏（魏征先后进谏二百余事）、轻徭薄赋、宽刑简政、任贤使能（房谋杜断）。贞观四年灭东突厥，四夷君长上尊号「天可汗」。米斗三四钱，外户不闭，行旅不赍粮。史家奉为帝制时代治世巅峰。",
    "outcome": "中国历史治世典范，唐朝国力鼎盛",
    "sources": [{"title": "旧唐书·太宗本纪", "type": "primary", "ref": "卷二至卷三"}, {"title": "贞观政要", "type": "primary"}],
    "_meta": {"created_by": "ai-pipeline", "model": "kimi-k3", "prompt_version": "suitang-v1", "version": 1}
  },
  {
    "id": "event.tang.xuanzang",
    "uuid": "3951d88f-aa55-478c-9f84-4303e8f7afa1",
    "name": "玄奘西行取经",
    "name_traditional": "玄奘西行取經",
    "category": ["cultural", "exploration"],
    "time": {"start": 629, "end": 645, "original": "贞观三年出发，贞观十九年归", "precision": "year"},
    "place": ["place.changan"],
    "participants": [{"person": "person.tang.lishimin", "role": "monarch"}],
    "related_events": ["event.tang.zhenguan"],
    "description": "玄奘法师违诏偷越国境，孤身西行五万里，历西域百三十余国至印度那烂陀寺求学，贞观十九年携佛经六百五十七部归长安。太宗亲撰《大唐三藏圣教序》。归国后于大慈恩寺译经十九年，其口述《大唐西域记》为研究中古南亚中亚史的第一手文献。",
    "outcome": "佛教中国化高峰；中印文化交流里程碑",
    "sources": [{"title": "大慈恩寺三藏法师传", "type": "primary"}, {"title": "大唐西域记", "type": "primary"}],
    "_meta": {"created_by": "ai-pipeline", "model": "kimi-k3", "prompt_version": "suitang-v1", "version": 1}
  },
  {
    "id": "event.tang.wencheng",
    "uuid": "0e71264e-beaf-4f68-89d4-b60562685f76",
    "name": "文成公主入藏",
    "name_traditional": "文成公主入藏",
    "category": ["diplomacy"],
    "time": {"start": 641, "end": 641, "original": "贞观十五年正月", "precision": "month"},
    "place": [],
    "participants": [{"person": "person.tang.lishimin", "role": "decision-maker"}],
    "related_events": ["event.tang.zhenguan"],
    "description": "吐蕃赞普松赞干布遣大相禄东赞入唐求婚，太宗以宗室女文成公主妻之。公主携大量经史、医典、工匠入藏，带去了中原的农耕、纺织、建筑与佛教文化，唐蕃自此结成舅甥之好，拉萨大昭寺至今供奉其像。",
    "outcome": "唐蕃和亲，汉藏交流史上的里程碑",
    "sources": [{"title": "旧唐书·吐蕃传", "type": "primary", "ref": "卷一百九十六"}],
    "_meta": {"created_by": "ai-pipeline", "model": "kimi-k3", "prompt_version": "suitang-v1", "version": 1}
  },
  {
    "id": "event.tang.wuzhou",
    "uuid": "f89d1745-635f-428b-8654-81df58eac5e9",
    "name": "武则天称帝建周",
    "name_traditional": "武則天稱帝建周",
    "category": ["regime-change"],
    "time": {"start": 690, "end": 690, "original": "天授元年九月九日", "precision": "day"},
    "place": ["place.luoyang"],
    "participants": [
      {"person": "person.tang.wuzetian", "role": "protagonist"},
      {"person": "person.tang.lidan", "role": "subject"}
    ],
    "related_events": ["event.tang.shenlong"],
    "description": "武后以太后身份临朝称制六年，先后废中宗、幽睿宗，大诛李唐宗室与反对大臣，又借《大云经》制造女主受命舆论。天授元年九月九日，六万七千人上表劝进，遂于则天门城楼改唐为周，自称圣神皇帝，以洛阳为神都。为中国历史上空前绝后的女皇帝。",
    "outcome": "武周代唐，中国历史上唯一正统女皇帝登基",
    "sources": [{"title": "旧唐书·则天皇后本纪", "type": "primary", "ref": "卷六"}],
    "_meta": {"created_by": "ai-pipeline", "model": "kimi-k3", "prompt_version": "suitang-v1", "version": 1}
  },
  {
    "id": "event.tang.shenlong",
    "uuid": "c3ab3e72-de1f-4220-9f95-8fad4304bada",
    "name": "神龙政变",
    "name_traditional": "神龍政變",
    "category": ["coup"],
    "time": {"start": 705, "end": 705, "original": "神龙元年正月二十二日", "precision": "day"},
    "place": ["place.luoyang"],
    "participants": [
      {"person": "person.tang.wuzetian", "role": "victim"},
      {"person": "person.tang.lixian", "role": "beneficiary"}
    ],
    "related_events": ["event.tang.wuzhou"],
    "description": "武则天晚年宠信张易之、张昌宗兄弟，朝政日非。宰相张柬之、崔玄暐联合羽林军发动政变，率兵斩关入宫杀二张，包围长生殿，逼武后传位于中宗李显。武周政权终结，李唐复国。十一月武则天崩于上阳宫，遗制去帝号，与高宗合葬乾陵。",
    "outcome": "武周终结，李唐复辟",
    "sources": [{"title": "旧唐书·中宗本纪", "type": "primary", "ref": "卷七"}, {"title": "资治通鉴·唐纪二十四", "type": "primary"}],
    "_meta": {"created_by": "ai-pipeline", "model": "kimi-k3", "prompt_version": "suitang-v1", "version": 1}
  },
  {
    "id": "event.tang.kaiyuan",
    "uuid": "019dc9db-505f-4d70-b01e-f1d7b8b2398d",
    "name": "开元盛世",
    "name_traditional": "開元盛世",
    "category": ["governance", "golden-age"],
    "time": {"start": 713, "end": 741, "original": "开元元年至二十九年", "precision": "year"},
    "place": ["place.changan"],
    "participants": [{"person": "person.tang.lilongji", "role": "decision-maker"}],
    "related_events": ["event.tang.anshi"],
    "description": "唐玄宗前期任姚崇、宋璟为相，裁汰冗官、抑制奢靡、劝课农桑、整理户籍。天下大治，海内富实，米斗十余钱，行旅万里不持寸兵。唐朝国力至此臻于极盛，长安成为当时世界最大最繁华的国际化都市。杜甫「忆昔开元全盛日，小邑犹藏万家室」即咏此时。",
    "outcome": "唐朝国力巅峰，中国古代经济文化高峰",
    "sources": [{"title": "旧唐书·玄宗本纪", "type": "primary", "ref": "卷八至卷九"}],
    "_meta": {"created_by": "ai-pipeline", "model": "kimi-k3", "prompt_version": "suitang-v1", "version": 1}
  },
  {
    "id": "event.tang.anshi",
    "uuid": "3dc8c351-e42c-45e0-a49f-95774ffadde6",
    "name": "安史之乱",
    "name_traditional": "安史之亂",
    "category": ["war", "rebellion"],
    "time": {"start": 755, "end": 763, "original": "天宝十四载十一月至广德元年正月", "precision": "year"},
    "place": ["place.fanyang", "place.changan", "place.luoyang", "place.mawei"],
    "participants": [
      {"person": "person.tang.lilongji", "role": "monarch"},
      {"person": "person.tang.liheng", "role": "monarch"},
      {"person": "person.tang.liyu", "role": "commander"}
    ],
    "related_events": ["event.tang.kaiyuan"],
    "description": "范阳、平卢、河东三镇节度使安禄山以讨杨国忠为名起兵，十五万铁骑席卷河北，次年陷洛阳、入潼关，玄宗仓皇奔蜀，马嵬驿兵变缢死杨贵妃。肃宗即位于灵武，赖郭子仪、李光弼及回纥援兵收复两京。安禄山、史思明父子相继称帝又相继被弑，广德元年史朝义自缢，乱平。八年战乱使黄河流域「人烟断绝，千里萧条」，唐朝由盛转衰，藩镇割据自此始。",
    "outcome": "唐朝由盛转衰，藩镇割据格局形成",
    "sources": [{"title": "旧唐书·安禄山传", "type": "primary", "ref": "卷二百上"}, {"title": "资治通鉴·唐纪", "type": "primary"}],
    "_meta": {"created_by": "ai-pipeline", "model": "kimi-k3", "prompt_version": "suitang-v1", "version": 1}
  },
  {
    "id": "event.tang.ganlu",
    "uuid": "5cb4ec6c-9934-40cc-a804-743b9cef45b6",
    "name": "甘露之变",
    "name_traditional": "甘露之變",
    "category": ["coup", "persecution"],
    "time": {"start": 835, "end": 835, "original": "大和九年十一月二十一日", "precision": "day"},
    "place": ["place.changan"],
    "participants": [{"person": "person.tang.liang", "role": "subject"}],
    "related_events": [],
    "description": "文宗深恨宦官专权，与李训、郑注密谋，诈称左金吾厅后石榴树上夜降甘露，诱宦官仇士良、鱼弘志等往观，欲伏兵尽诛之。事机不密，风吹幕起露出伏兵，宦官急挟文宗还宫，发禁兵大杀朝官，宰相王涯等千余人被族诛，长安血流成河。自此宦官专权更甚，文宗自叹「受制于家奴」。",
    "outcome": "朝臣诛宦失败，宦官专权至唐亡",
    "sources": [{"title": "旧唐书·文宗本纪", "type": "primary", "ref": "卷十七下"}, {"title": "资治通鉴·唐纪六十一", "type": "primary"}],
    "_meta": {"created_by": "ai-pipeline", "model": "kimi-k3", "prompt_version": "suitang-v1", "version": 1}
  },
  {
    "id": "event.tang.huichang",
    "uuid": "5d7b8121-ae4c-4f7b-96a1-4db675277954",
    "name": "会昌灭佛",
    "name_traditional": "會昌滅佛",
    "category": ["policy", "persecution"],
    "time": {"start": 845, "end": 845, "original": "会昌五年四月至八月", "precision": "month"},
    "place": ["place.changan"],
    "participants": [{"person": "person.tang.liyan", "role": "decision-maker"}],
    "related_events": [],
    "description": "武宗以佛教寺院广占良田、僧尼不课不役耗蠹天下为由，下诏毁佛：毁佛寺四千六百余所、招提兰若四万余，僧尼还俗二十六万五百人，收奴婢为两税户十五万，收良田数千万顷。与北魏太武帝、北周武帝灭佛并称「三武之厄」。次年武宗崩，宣宗即位即复兴佛教。",
    "outcome": "佛教势力大挫，国库稍充；武宗死后即复",
    "sources": [{"title": "旧唐书·武宗本纪", "type": "primary", "ref": "卷十八上"}, {"title": "资治通鉴·唐纪六十四", "type": "primary"}],
    "_meta": {"created_by": "ai-pipeline", "model": "kimi-k3", "prompt_version": "suitang-v1", "version": 1}
  },
  {
    "id": "event.tang.huangchao",
    "uuid": "84cfb781-4ad5-40f5-84c4-62095e5580a0",
    "name": "黄巢起义",
    "name_traditional": "黃巢起義",
    "category": ["uprising"],
    "time": {"start": 875, "end": 884, "original": "乾符二年至中和四年", "precision": "year"},
    "place": [],
    "participants": [{"person": "person.tang.lixuan-xi", "role": "monarch"}],
    "related_events": [],
    "description": "盐贩出身的黄巢应王仙芝起义，仙芝死后统率义军，转战大半个中国，纵横万里。广明元年陷洛阳、破潼关、入长安，僖宗奔蜀。黄巢称帝，国号大齐。中和四年败死于泰山狼虎谷。起义十年，沉重打击了门阀士族，唐朝统治名存实亡，朱温、李克用等军阀由此崛起。",
    "outcome": "唐朝统治崩溃，藩镇完全坐大",
    "sources": [{"title": "旧唐书·黄巢传", "type": "primary", "ref": "卷二百下"}, {"title": "资治通鉴·唐纪", "type": "primary"}],
    "_meta": {"created_by": "ai-pipeline", "model": "kimi-k3", "prompt_version": "suitang-v1", "version": 1}
  }
]
